URL,Image Link,Title,Author,Date,Location,Description
https://www.ndtv.com/india-news/ukraine-sumy-we-will-be-killed-narendra-modi-ji-please-help-us-indian-students-heartbreaking-video-2803567,https://c.ndtvimg.com/2022-03/fnuhdhj_indian-student-sumy_120x90_04_March_22.jpg,"""We'll Be Killed. Modi-Ji, Please Help Us"": Student's Heartbreaking Video",Debanish Achom," Friday March 04, 2022", New Delhi,"A group of Indian students in Sumy, a city in conflict-hit Ukraine's northeast, have asked Prime Minister Narendra Modi for help to evacuate them amid the Russian invasion. In a video message, some 100 students are seen pleading for assistance."
https://www.ndtv.com/india-news/india-abstains-in-unhrc-vote-on-establishing-independent-commission-of-inquiry-on-russia-ukraine-crisis-2803550,https://c.ndtvimg.com/2022-02/6h2s5m7g_ukraine-afp_120x90_28_February_22.jpg,India Abstains As UN Rights Body Backs Probe Of Ukraine Conflict Violations,Press Trust of India," Friday March 04, 2022", Geneva/United Nations,India on Friday abstained in a vote in the UN Human Rights Council that has decided to urgently establish an independent international commission of inquiry as a result of Russia's aggression against Ukraine.
https://www.ndtv.com/india-news/26-candidates-in-up-polls-declared-criminal-cases-against-themselves-report-2803533,https://c.ndtvimg.com/2019-05/v3q1vhis_evm-generic_120x90_23_May_19.jpg,26% Candidates In UP Polls Declared Criminal Cases Against Themselves: Report,Press Trust of India," Friday March 04, 2022", New Delhi,"As much as 26 per cent of the 4,406 candidates in the ongoing Uttar Pradesh polls whose affidavits were analysed have declared criminal cases against themselves, according to a report by poll watchdog Association for Democratic Reforms (ADR)."
https://www.ndtv.com/india-news/take-us-out-of-rti-say-armed-forces-in-fresh-appeal-2803530,https://c.ndtvimg.com/2022-03/e7soeakc_rajput-regiment-republic-day-parade-ani_120x90_04_March_22.jpg,"Take Us Out Of RTI, Say Armed Forces In Fresh Appeal",Sunil Prabhu," Friday March 04, 2022", New Delhi,"The armed forces have made a fresh appeal to be excluded from the Right to Information or RTI Act, saying that they have not only found instances where the transparency law could be harming national security but compromising the chain of command as w"
https://www.ndtv.com/india-news/ukraine-russia-war-2-indian-air-force-planes-on-standby-for-ukraine-evacuation-via-russia-2803298,https://c.ndtvimg.com/2022-03/mj5oorso_indian-students-in-ukraine-afp-240_120x90_01_March_22.jpg,2 Indian Air Force Planes On Standby For Ukraine Evacuation Via Russia,Press Trust of India," Friday March 04, 2022", New Delhi,"The Indian Air Force (IAF) has kept two IL-76 military transport aircraft on standby to evacuate Indians who are stranded in conflict-hit eastern Ukrainian cities like Sumy and Kharkiv from Russian capital Moscow, officials said on Friday."
https://www.ndtv.com/india-news/ukraine-russia-crisis-tripura-chief-minister-biplab-kumar-deb-to-sponsor-delhi-agartala-airfare-of-ukraine-returnees-2803494,https://i.ndtvimg.com/i/2018-03/biplab-kumar-deb-bjp-tripura_240x180_61520073734.jpg,Tripura Chief Minister To Sponsor Delhi-Agartala Airfare Of Ukraine Returnees,Asian News International," Friday March 04, 2022", Agartala,Tripura Chief Minister Biplab Kumar Deb on Friday said that he has decided to contribute from his salary for the airfare of Delhi-Agartala flights for the students of Tripura who are returning from war-torn Ukraine.
https://www.ndtv.com/india-news/watch-drone-footage-captures-anti-collision-test-by-railways-2803489,https://c.ndtvimg.com/2022-03/d7lr23g4_train-test-240_120x90_04_March_22.jpg,Watch: Drone Footage Captures Anti-Collision Test By Railways,Ashutosh Tripathi," Friday March 04, 2022", New Delhi,"Two trains are running towards each other but don't collide, courtesy an indigenously developed Automatic Train Protection (ATP) system developed by the Railways. A drone video captured the dramatic footage."
https://www.ndtv.com/india-news/certain-incidents-during-governors-address-must-be-avoided-vice-president-venkaiah-naidu-2803421,https://c.ndtvimg.com/2020-09/5rg157k_venkaiah-naidu-pti_120x90_11_September_20.jpg,Certain Incidents During Governors' Address Must Be Avoided: Vice President,Press Trust of India," Friday March 04, 2022", Panaji,"Certain incidents happening during Governors' address and violence taking place in certain institutions should be completely avoided as such things will weaken democracy and leave people disillusioned, Vice President M Venkaiah Naidu said on Friday."
